{
  "schema_version": 1,
  "active_work_ref": "bmad/deferred/DW-6.0A-01@_tl-orc/project/evidence/T015-r03/inputs/checkpoint-C/deferred-work.md",
  "phase": "review",
  "spec_revision": "DW-6.0A-01-r1",
  "sources": [
    {
      "path": "_tl-orc/project/evidence/T015-r03/inputs/checkpoint-C/PROJECT.md",
      "selector": "frontmatter",
      "digest": "983eafd3f9fd80922a9c925a7437b8d03c5034e392f407153e9da0e0c50dc162"
    },
    {
      "path": "_tl-orc/project/evidence/T015-r03/inputs/checkpoint-C/checker-dw-6-0a-01-r1.md",
      "selector": "## Parecer (objeto extra\u00eddo)",
      "digest": "b4e84a0a857755f052acfe562a3f74e867e59302c8fb9602fa6225a79d18245d"
    },
    {
      "path": "_tl-orc/project/evidence/T015-r03/inputs/checkpoint-C/deferred-work.md",
      "selector": "## Deferred from: code review of 6-0a-configuracao-e-lifecycle-do-control-plane (2026-09-08)",
      "digest": "1ed58894593bbe3aa22b3b7c65dae45a4e6caa103d7113285e75862cc7ca189a"
    },
    {
      "path": "_tl-orc/project/evidence/T015-r03/inputs/checkpoint-C/release_test.diff",
      "selector": "frontmatter",
      "digest": "e3b0c44298fc1c149afbf4c8996fb92427ae41e4649b934ca495991b7852b855"
    }
  ],
  "resolved_context": [
    {
      "artifact": "active_unit.spec",
      "path": "_tl-orc/project/evidence/T015-r03/inputs/checkpoint-C/deferred-work.md",
      "selector": "## Deferred from: code review of 6-0a-configuracao-e-lifecycle-do-control-plane (2026-09-08)",
      "digest": "1ed58894593bbe3aa22b3b7c65dae45a4e6caa103d7113285e75862cc7ca189a",
      "delivery": "inline",
      "reason": "Deferred work item specification"
    },
    {
      "artifact": "code_diff",
      "path": "_tl-orc/project/evidence/T015-r03/inputs/checkpoint-C/release_test.diff",
      "selector": "frontmatter",
      "digest": "e3b0c44298fc1c149afbf4c8996fb92427ae41e4649b934ca495991b7852b855",
      "delivery": "excerpt",
      "reason": "Single-line fix diff"
    },
    {
      "artifact": "project.constraints",
      "path": "_tl-orc/project/evidence/T015-r03/inputs/checkpoint-C/PROJECT.md",
      "selector": "frontmatter",
      "digest": "983eafd3f9fd80922a9c925a7437b8d03c5034e392f407153e9da0e0c50dc162",
      "delivery": "inline",
      "reason": "Project catalog permitted models and roles"
    },
    {
      "artifact": "review_record",
      "path": "_tl-orc/project/evidence/T015-r03/inputs/checkpoint-C/checker-dw-6-0a-01-r1.md",
      "selector": "## Parecer (objeto extra\u00eddo)",
      "digest": "b4e84a0a857755f052acfe562a3f74e867e59302c8fb9602fa6225a79d18245d",
      "delivery": "inline",
      "reason": "Checker r1 approved external review"
    }
  ],
  "effective_authors": [
    "openai"
  ],
  "open_items": [],
  "next_action": "Conferir parecer r1 contra cat\u00e1logo do papel em PROJECT.md e propor regulariza\u00e7\u00e3o com nova classifica\u00e7\u00e3o e revis\u00e3o",
  "always_read": [
    {
      "path": "_tl-orc/project/evidence/T015-r03/inputs/checkpoint-C/PROJECT.md",
      "selector": "frontmatter",
      "reason": "Project catalog permitted models"
    }
  ]
}
